{
  "schema_version": "1.0.0",
  "producer_version": "0.1.0",
  "lane": "governance",
  "host_id": "local-host-example",
  "source_hashes": ["sha256:a33654b1a37a47a98349d3b36deabda4c675e2179209fdada94227b7ab4c8ec5"],
  "run_id": "run-phase0-example",
  "parent_run_id": "none",
  "caller": "governance-cli",
  "source_surface": "cli",
  "command": "doctor",
  "execution_host": "local-host-example",
  "inspected_scope": ["schemas", "migration-skeleton", "capability-matrix"],
  "accepted_ids": [],
  "refused_ids": [],
  "terminal_outcome": "no-work",
  "counts": {
    "requests": 0,
    "bytes": 0,
    "cache_hits": 0,
    "duplicates": 0,
    "parser_failures": 0,
    "render_needed": 0,
    "accepted": 0,
    "refused": 0
  },
  "budget_outcome": "not-applicable-phase0",
  "duration_ms": 0,
  "artifact_paths": [],
  "delivery_state": "not-applicable-phase0",
  "error_summary": "",
  "software_commit": "uncommitted-phase0-example",
  "software_version": "0.1.0",
  "schema_versions": ["artifact/1.0.0", "capability/1.0.0", "policy/1.0.0", "receipt/1.0.0", "registry/1.0.0"],
  "adapter_version": "not-applicable-phase0",
  "normalization_policy_version": "not-built",
  "policy_hash": "fixture-policy-hash",
  "configuration_hash": "fixture-configuration-hash",
  "seed_manifest_hash": "not-applicable",
  "evidence_availability_state": "not-applicable",
  "compact_receipt_path": "state/governance/receipts/2026.07.20/local-host-example-run-phase0-example.json",
  "created_at_utc": "2026-07-20T00:00:00Z",
  "implementation_status": "phase0-contract-only"
}
